{
  "license": "https://www.apache.org/licenses/LICENSE-2.0",
  "$schema": "https://json-schema.org/draft/2020-12/schema",
  "$id": "https://w3id.org/battinfo/schema/electrode.schema.json",
  "title": "BattINFO Electrode Instance",
  "description": "A physical electrode batch (coated web, sheet or punched discs) realizing an electrode-spec. The 'instance' half of the electrode-spec + electrode pair; as-built actuals live in the open 'property' map, never in a closed vocabulary.",
  "type": "object",
  "additionalProperties": false,
  "required": [
    "schema_version",
    "electrode",
    "provenance"
  ],
  "properties": {
    "schema_version": {
      "type": "string",
      "pattern": "^\\d+\\.\\d+\\.\\d+(-[A-Za-z0-9.-]+)?$",
      "description": "Version of the record schema this document conforms to (semantic versioning); stamped by the library on save."
    },
    "electrode": {
      "type": "object",
      "additionalProperties": false,
      "required": [
        "id",
        "electrode_spec_id"
      ],
      "properties": {
        "id": {
          "$ref": "#/$defs/ComponentIri"
        },
        "electrode_spec_id": {
          "$ref": "#/$defs/ComponentSpecIri",
          "description": "Canonical IRI of the electrode-spec this batch realizes. Required: a built electrode without a design is not describable."
        },
        "short_id": {
          "$ref": "#/$defs/ShortId"
        },
        "name": {
          "type": "string",
          "description": "Human-readable label for this batch."
        },
        "handle": {
          "$ref": "#/$defs/Handle",
          "description": "Short readable slug, unique within one registry workspace (e.g. 'flores-ocv/graphite-aq-1-063b77-cell'). Display text, never part of the identity."
        },
        "lot_id": {
          "type": "string",
          "description": "Producer / supplier lot number for a purchased electrode."
        },
        "parent_id": {
          "$ref": "#/$defs/ComponentIri",
          "description": "Canonical IRI of the electrode this piece was cut from - the coated roll, web, or strip its siblings share. The parent is itself an electrode record (usually realizing the same spec), so genealogy chains compose: cell -> disc -> parent roll -> electrode-spec."
        },
        "piece_id": {
          "type": "string",
          "minLength": 1,
          "description": "Label of this cut piece within its parent (e.g. 'disc-07', 'strip-B'). Joins the identity seed, so pieces cut from the same parent mint distinct IRIs."
        },
        "batch_id": {
          "type": "string",
          "description": "Coating batch label (e.g. 'Si-AQ-1'). Together with the spec IRI this is the batch's identity — the IRI is minted from the pair."
        },
        "supplier": {
          "$ref": "#/$defs/OrgRef",
          "description": "Supplier or vendor the item was sourced from."
        },
        "manufactured_at": {
          "$ref": "#/$defs/FlexDate",
          "description": "Date this batch was coated / built."
        },
        "received_date": {
          "$ref": "#/$defs/FlexDate",
          "description": "Date a purchased batch was received."
        },
        "expires_at": {
          "$ref": "#/$defs/FlexDate"
        },
        "amount": {
          "$ref": "modules/common/quantity.schema.json",
          "description": "Quantity of this batch on hand or consumed (e.g. coated area in cm2, web length in m, mass in g)."
        },
        "count": {
          "type": "integer",
          "minimum": 0,
          "description": "Number of discrete pieces in this batch (e.g. punched discs)."
        },
        "storage": {
          "type": "string",
          "description": "Storage conditions for this batch (e.g. 'argon glovebox', 'dry room, -40 degC dew point')."
        },
        "datasets": {
          "type": "array",
          "items": {
            "$ref": "#/$defs/DatasetLink"
          },
          "uniqueItems": true,
          "description": "Characterization datasets for this batch (thickness maps, SEM, adhesion, half-cell checks, ...)."
        },
        "property": {
          "$ref": "modules/common/quantitative-properties.schema.json",
          "description": "As-built batch actuals — measured loading, measured calendered thickness, measured porosity, disc diameter, disc mass. An open snake_case map: whatever this batch was actually measured for is recordable without a schema change."
        },
        "comment": {
          "type": "string",
          "description": "Free-text comment."
        }
      },
      "description": "The physical electrode being described."
    },
    "provenance": {
      "$ref": "#/$defs/Provenance",
      "description": "Where the information in this record came from: source type, file or URL, citation, and retrieval time."
    },
    "notes": {
      "type": "array",
      "items": {
        "type": "string"
      }
    },
    "funding": {
      "$ref": "#/$defs/Funding"
    },
    "contributor": {
      "type": "array",
      "items": {
        "$ref": "#/$defs/Person"
      },
      "minItems": 1,
      "description": "People who contributed this record to the platform (attribution/provenance). Each is a schema:Person; an ORCID may be given in same_as. Stamped by ws.save."
    },
    "license": {
      "type": "string",
      "minLength": 1,
      "description": "License under which this record is released, as an SPDX identifier (e.g. \"cc-by-4.0\") or a URL. Stamped from the workspace default (ws.license) and emitted as dcterms:license in JSON-LD."
    }
  },
  "$defs": {
    "ComponentIri": {
      "type": "string",
      "pattern": "^https://w3id\\.org/battinfo/electrode/[0-9a-hjkmnp-tv-z]{4}(?:-[0-9a-hjkmnp-tv-z]{4}){3}$",
      "description": "Canonical BattINFO IRI in the electrode/ namespace (https://w3id.org/battinfo/electrode/xxxx-xxxx-xxxx-xxxx)."
    },
    "ComponentSpecIri": {
      "type": "string",
      "pattern": "^https://w3id\\.org/battinfo/(?:spec|material-spec|electrode-spec|separator-spec|electrolyte-spec|current-collector-spec|housing-spec)/[0-9a-hjkmnp-tv-z]{4}(?:-[0-9a-hjkmnp-tv-z]{4}){3}$"
    },
    "ShortId": {
      "type": "string",
      "pattern": "^[0-9a-hjkmnp-tv-z]{6,16}$",
      "description": "Short human-friendly identifier derived from the record IRI (Crockford base32, 6-16 characters)."
    },
    "Handle": {
      "type": "string",
      "pattern": "^[a-z0-9]+(?:-[a-z0-9]+)*(?:/[a-z0-9]+(?:-[a-z0-9]+)*)*$",
      "maxLength": 120,
      "description": "Short readable slug for this record, unique within one registry workspace and shown as <workspace>/<handle> (e.g. 'flores-ocv/graphite-aq-1-063b77-cell'). Lowercase ASCII segments joined by '/', each made of letters and digits separated by single hyphens; at most 120 characters. Display text only: the record's identity is its IRI, and a handle may be corrected without moving it. Build one with battinfo.naming.handle_for()."
    },
    "UnixTime": {
      "type": "integer",
      "minimum": 0,
      "description": "Unix timestamp in whole seconds since 1970-01-01T00:00:00Z."
    },
    "FlexDate": {
      "oneOf": [
        {
          "$ref": "#/$defs/UnixTime"
        },
        {
          "type": "string",
          "pattern": "^\\d{4}(-\\d{2}(-\\d{2})?)?$",
          "description": "ISO 8601 calendar date string: YYYY, YYYY-MM, or YYYY-MM-DD."
        }
      ],
      "description": "Date as an ISO 8601 string (YYYY, YYYY-MM, or YYYY-MM-DD) or a Unix timestamp in seconds."
    },
    "DatasetIri": {
      "type": "string",
      "pattern": "^https://w3id\\.org/battinfo/dataset/[0-9a-hjkmnp-tv-z]{4}(?:-[0-9a-hjkmnp-tv-z]{4}){3}$",
      "description": "Canonical BattINFO IRI in the dataset/ namespace (https://w3id.org/battinfo/dataset/xxxx-xxxx-xxxx-xxxx)."
    },
    "DatasetLink": {
      "type": "object",
      "additionalProperties": false,
      "required": [
        "id"
      ],
      "properties": {
        "id": {
          "$ref": "#/$defs/DatasetIri",
          "description": "Canonical IRI of the linked dataset record."
        },
        "role": {
          "type": "string",
          "enum": [
            "raw",
            "processed",
            "report",
            "metadata",
            "other"
          ],
          "description": "Role of the linked dataset as a whole relative to this record (record level; the per-file role lives on the dataset's distribution entries)."
        }
      },
      "description": "Link to a dataset record, with the role the dataset plays for this record."
    },
    "OrganizationIri": {
      "type": "string",
      "pattern": "^https://w3id\\.org/battinfo/organization/[0-9a-hjkmnp-tv-z]{4}(?:-[0-9a-hjkmnp-tv-z]{4}){3}$",
      "description": "Canonical BattINFO IRI in the organization/ namespace (https://w3id.org/battinfo/organization/xxxx-xxxx-xxxx-xxxx)."
    },
    "Organization": {
      "type": "object",
      "additionalProperties": false,
      "required": [
        "name"
      ],
      "properties": {
        "type": {
          "const": "Organization",
          "description": "JSON-LD type discriminator."
        },
        "id": {
          "$ref": "#/$defs/OrganizationIri",
          "description": "Canonical BattINFO organization IRI linking this party to its organization record."
        },
        "name": {
          "type": "string",
          "minLength": 1,
          "description": "Organization name."
        },
        "url": {
          "type": "string",
          "format": "uri",
          "description": "Homepage URL."
        },
        "same_as": {
          "type": "string",
          "format": "uri",
          "description": "External identifier IRI for this organization (e.g. ROR or Wikidata)."
        }
      },
      "description": "An organization referenced by name, with an optional canonical BattINFO organization IRI."
    },
    "OrgRef": {
      "oneOf": [
        {
          "type": "string",
          "minLength": 1
        },
        {
          "$ref": "#/$defs/Organization"
        }
      ],
      "description": "An organization, as either a plain name string or a structured Organization object that can carry a canonical organization IRI."
    },
    "Funding": {
      "type": "object",
      "additionalProperties": false,
      "description": "Funding project (grant) under which the record was produced. Maps to schema:funding / schema:Grant in JSON-LD.",
      "required": [
        "identifier"
      ],
      "properties": {
        "type": {
          "const": "Grant"
        },
        "id": {
          "type": "string",
          "format": "uri"
        },
        "identifier": {
          "type": "string",
          "minLength": 1
        },
        "name": {
          "type": "string"
        },
        "acronym": {
          "type": "string"
        },
        "program": {
          "type": "string"
        },
        "funder": {
          "type": "object",
          "additionalProperties": false,
          "required": [
            "name"
          ],
          "properties": {
            "type": {
              "const": "Organization"
            },
            "name": {
              "type": "string",
              "minLength": 1
            },
            "url": {
              "type": "string",
              "format": "uri"
            },
            "same_as": {
              "type": "string",
              "format": "uri"
            }
          }
        }
      }
    },
    "Person": {
      "type": "object",
      "additionalProperties": false,
      "required": [
        "name"
      ],
      "properties": {
        "type": {
          "const": "Person"
        },
        "name": {
          "type": "string",
          "minLength": 1
        },
        "given_name": {
          "type": "string",
          "minLength": 1
        },
        "family_name": {
          "type": "string",
          "minLength": 1
        },
        "email": {
          "type": "string",
          "format": "email"
        },
        "url": {
          "type": "string",
          "format": "uri"
        },
        "same_as": {
          "type": "string",
          "format": "uri"
        },
        "affiliation": {
          "anyOf": [
            {
              "$ref": "#/$defs/Organization"
            },
            {
              "type": "array",
              "items": {
                "$ref": "#/$defs/Organization"
              },
              "minItems": 1
            }
          ],
          "description": "Organization(s) the person is affiliated with: one, or a list."
        }
      }
    },
    "Provenance": {
      "type": "object",
      "additionalProperties": false,
      "required": [
        "source_type"
      ],
      "properties": {
        "source_type": {
          "type": "string",
          "enum": [
            "datasheet",
            "manufacturer",
            "measurement",
            "lab",
            "literature",
            "manual",
            "other"
          ],
          "description": "Kind of source this record was created from."
        },
        "source_name": {
          "type": "string",
          "description": "Human-readable name of the source (document title, instrument, lab, or system)."
        },
        "source_file": {
          "type": "string",
          "description": "Filename or path of the source file, when the record was derived from a file."
        },
        "source_url": {
          "oneOf": [
            {
              "type": "string",
              "format": "uri"
            },
            {
              "type": "null"
            }
          ],
          "description": "URL of the source document or landing page, when available."
        },
        "citation": {
          "type": "string",
          "format": "uri",
          "description": "Resolvable citation target to use for attribution, typically a DOI URL."
        },
        "citation_doi": {
          "type": "string",
          "pattern": "^10\\.\\d{4,9}/[-._;()/:A-Za-z0-9]+$",
          "description": "DOI of the source publication (bare '10.xxxx/...' form). Prefer provenance.citation with a DOI resolver URL."
        },
        "retrieved_at": {
          "$ref": "#/$defs/UnixTime",
          "description": "Unix timestamp (seconds since epoch, UTC) when the source was retrieved or the record was captured."
        },
        "battinfo_version": {
          "type": "string",
          "pattern": "^\\d+\\.\\d+\\.\\d+(((a|b|rc)\\d+)?(\\.post\\d+)?(\\.dev\\d+)?(\\+[A-Za-z0-9.]+)?|-[A-Za-z0-9.-]+)$",
          "description": "Version of the battinfo library that wrote this record, stamped on save: X.Y.Z with an optional PEP 440 suffix (0.8.0rc1, 0.8.0.dev1, 0.8.0.post1, 0.8.0+local) or a hyphenated one (0.8.0-rc1)."
        }
      },
      "description": "Where the information in this record came from: source type, file or URL, citation, and retrieval time."
    }
  }
}
