{
  "schema_version": "0.2.0",
  "electrode": {
    "id": "https://w3id.org/battinfo/electrode/sbfx-ka57-1ky3-hkgk",
    "electrode_spec_id": "https://w3id.org/battinfo/spec/qfjh-7xyr-ga1k-tjez",
    "short_id": "sbfxka",
    "property": {
      "diameter": {
        "value": 11,
        "unit": "mm"
      },
      "mass": {
        "value": 23.0,
        "unit": "mg"
      }
    },
    "name": "NMC811 cathode disc (11 mm)",
    "lot_id": "CATH-NMC811-001"
  },
  "provenance": {
    "source_type": "lab",
    "retrieved_at": 1781742522
  },
  "notes": [
    "A built NMC811 cathode disc (11 mm) from the Discovery-Benchmark coin-cell line."
  ]
}
